{
  "id": "in-2026-09-ai-regulation",
  "schemaVersion": 1,
  "contentVersion": 1,
  "country": "IN",
  "category": "tech",
  "status": "published",
  "question": "Is AI regulation needed before 2026 in India?",
  "context": "A draft framework would require audits for high-risk AI systems. Industry bodies warn about compliance cost for startups. Researchers argue the guardrails are overdue.",
  "sides": {
    "yes": "YES",
    "no": "NO"
  },
  "sources": [
    {
      "name": "The Hindu",
      "url": "https://www.thehindu.com/sci-tech/technology/ai-regulation-draft/article87654321.ece",
      "verified": true,
      "publishedAt": "2026-09-12"
    }
  ],
  "tags": [],
  "trendScore": 87,
  "publishedAt": "2026-09-14T17:02:50.389Z",
  "activeFrom": "2026-09-14T17:02:50.389Z",
  "activeUntil": "2026-10-01T17:02:50.389Z",
  "review": {
    "tier": "auto_publish",
    "state": "auto_approved",
    "reviewedBy": null,
    "reviewedAt": null,
    "reason": null
  },
  "generation": {
    "model": "claude-opus-5",
    "pipelineRun": "2026-09-14T17:02:50.389Z",
    "generatedAt": "2026-09-14T17:02:50.389Z",
    "sourceCount": 1
  },
  "bookmarks": 15600
}
