{
  "id": "in-2026-09-special-intensive-review-electoral-rolls",
  "schemaVersion": 1,
  "contentVersion": 1,
  "country": "IN",
  "category": "politics",
  "status": "in_review",
  "question": "Should the Special Intensive Review of Electoral Rolls continue?",
  "context": "The Election Commission is conducting a large-scale review to remove ineligible voters and duplicates from electoral rolls. Supporters say this ensures only eligible citizens vote. Critics say the process lacks transparency and safeguards, risking removal of valid voters.",
  "sides": {
    "yes": "Continue SIR",
    "no": "Suspend SIR"
  },
  "sources": [
    {
      "name": "2025 Indian electoral controversy",
      "url": "https://en.wikipedia.org/wiki/2025_Indian_electoral_controversy",
      "verified": false,
      "publishedAt": "2025-01-01"
    },
    {
      "name": "The State of Indian Politics in 2026",
      "url": "https://carnegieendowment.org/podcasts/grand-tamasha/the-state-of-indian-politics-in-2026",
      "verified": false,
      "publishedAt": "2026-01-01"
    },
    {
      "name": "2026 elections in India",
      "url": "https://en.wikipedia.org/wiki/2026_elections_in_India",
      "verified": false,
      "publishedAt": "2025-01-01"
    }
  ],
  "tags": [],
  "trendScore": 72,
  "publishedAt": "2026-09-24T11:02:05.828Z",
  "activeFrom": "2026-09-24T11:02:05.828Z",
  "activeUntil": "2026-10-01T11:02:05.828Z",
  "review": {
    "tier": "review_required",
    "state": "pending",
    "reviewedBy": null,
    "reviewedAt": null,
    "reason": null
  },
  "generation": {
    "model": "claude-haiku-4-5-20251001",
    "pipelineRun": "35990512539",
    "generatedAt": "2026-09-24T11:02:05.828Z",
    "sourceCount": 3
  },
  "bookmarks": 0
}
