{
  "id": "in-2026-09-ipl-window",
  "schemaVersion": 1,
  "contentVersion": 1,
  "country": "IN",
  "category": "cricket",
  "status": "published",
  "question": "Should the IPL have a separate window in the calendar?",
  "context": "A dedicated slot would stop the league clashing with international fixtures. Boards outside India resist losing player availability elsewhere in the year.",
  "sides": {
    "yes": "YES",
    "no": "NO"
  },
  "sources": [
    {
      "name": "ESPNcricinfo",
      "url": "https://www.espncricinfo.com/story/ipl-dedicated-window-debate-1234567",
      "verified": true,
      "publishedAt": "2026-09-10"
    }
  ],
  "tags": [],
  "trendScore": 68,
  "publishedAt": "2026-09-12T17:02:50.389Z",
  "activeFrom": "2026-09-12T17:02:50.389Z",
  "activeUntil": "2026-09-26T17:02:50.389Z",
  "review": {
    "tier": "auto_publish",
    "state": "auto_approved",
    "reviewedBy": null,
    "reviewedAt": null,
    "reason": null
  },
  "generation": {
    "model": "claude-opus-5",
    "pipelineRun": "2026-09-12T17:02:50.389Z",
    "generatedAt": "2026-09-12T17:02:50.389Z",
    "sourceCount": 1
  },
  "bookmarks": 22100
}
