{
  "id": "in-2026-09-four-day-week",
  "schemaVersion": 1,
  "contentVersion": 1,
  "country": "IN",
  "category": "jobs",
  "status": "published",
  "question": "Should India move to a four-day work week?",
  "context": "A proposal to reduce the standard workweek from 5 days to 4 while keeping 40 hours. Supporters point to productivity and well-being. Opponents cite economic challenges.",
  "sides": {
    "yes": "YES",
    "no": "NO"
  },
  "sources": [
    {
      "name": "The Hindu",
      "url": "https://www.thehindu.com/business/four-day-week-proposal/article12345678.ece",
      "verified": true,
      "publishedAt": "2026-09-18"
    },
    {
      "name": "Mint",
      "url": "https://www.livemint.com/economy/shorter-week-india-11758000000000.html",
      "verified": true,
      "publishedAt": "2026-09-18"
    }
  ],
  "tags": [],
  "trendScore": 91,
  "publishedAt": "2026-09-20T17:02:50.389Z",
  "activeFrom": "2026-09-20T17:02:50.389Z",
  "activeUntil": "2026-09-24T17:02:50.389Z",
  "review": {
    "tier": "review_required",
    "state": "approved",
    "reviewedBy": "editor",
    "reviewedAt": "2026-09-20T17:02:50.389Z",
    "reason": null
  },
  "generation": {
    "model": "claude-opus-5",
    "pipelineRun": "2026-09-20T17:02:50.389Z",
    "generatedAt": "2026-09-20T17:02:50.389Z",
    "sourceCount": 2
  },
  "bookmarks": 12400
}
